{
  "schema_version": 1,
  "component": "herdr",
  "flake_inputs": {
    "herdr": {
      "url": "github:herdrdev/herdr/v0.9.3"
    }
  },
  "versions_lock": {
    "flake_inputs": {
      "herdr": {
        "reference": "github:herdrdev/herdr/v0.9.3",
        "revision": "7b116c05bfda646af39d2524c54e70c751f57ee8",
        "version": "0.9.3",
        "nar_hash": "sha256-uu452Xe23pSvFk7w7fKPjiaqY5QenUIljao2SFAxpc0="
      }
    },
    "nix_packages": {
      "herdr": {
        "expected": "0.9.3",
        "resolved": "0.9.3"
      }
    }
  }
}
